"appropriation_category","appropriation code","appropriation activity","branch","fiscal_year_start","fiscal_year_end","budget_activity_number","budget_activity_title","pem","budget_title","program_base_congressional","program_base_dod","reprogramming_amount","revised_program_total","explanation","file"
"Missile Procurement","","","","2016","2030","05","Other Support","0207040F","Component Serial Number (Amounts in Thousands of Dollars)","16","18","05","276,562","Funds are required for a classified effort. Additional classified details will be provided under separate cover. This is a base budget requirement.","16-30_PA_August_2016_Request.pdf"
"Operation and Maintenance","","","","2016","2030","02","Mobilization 917,948 917,948 889,948","0603748N","Yes

Component Serial Number (Amounts in Thousands of Dollars)","16","16","02","917,948","Funds are available for Expeditionary Medical Facilities systems upgrades due to the legal determination that the new and existing systems will be purchased with Other Procurement, Navy. This is a congressional special interest item. This is base budget funding.","16-30_PA_August_2016_Request.pdf"
"","","","","2016","2030","04","Other Base Maintenance and Support Equipment","","Yes

Component Serial Number (Amounts in Thousands of Dollars)","24,730","16","18","5,750","Funds are available because of requirement and price changes due to an evolving mission for the standup of the Agadez, Niger base infrastructure. Funds were initially requested in the President's Budget to procure tent flooring, airfield lighting, a guard tower, and base barriers. After the initial footprint in Agadez, the Air Force stood up a new unit, the Air Force Installation and Mission Support Center (AFIMSC) Detachment 4, on October 1, 2015. This unit supports installation management across United States Air Forces in Europe and Air Forces Africa (USAFE-AFAFRICA). The AFIMSC Detachment 4 reprioritized the basing, bed down, security, and force protection issues to the current Agadez mission. This is base budget funding.","16-30_PA_August_2016_Request.pdf"
"Operation and Maintenance","","","","2016","2030","01","Operating Forces","","SAC Denied
","16","16","01","30,676,122","Funds are required to support European Reassurance Initiative (ERI) proposal A.1 (“Armored Brigade Combat Team (ABCT) Presence”), including requirements associated with 1.0 ABCT presence in Eastern Europe and the related Army prepositioned stocks unit sets. This is an OCO budget requirement.","16-30_PA_August_2016_Request.pdf"
"Operation and Maintenance","","","Army","2015","2015","04","Administration and Servicewide Activities","","Defense Security Cooperation Agency
","16","16","04","3,178,545","Funds are required to implement the Mission Partner Environment-Information System (MPE-IS) global node at United States Central Command (USCENTCOM) Headquarters, MacDill Air Force Base, Florida. This node replaces the currently independent physically-based network hosting environments of CENTCOM's national and international coalition partners into a Virtual Data Center (VDC) capability, allowing for a common mission network (system infrastructure framework and computing environment) for all Communities of Interest (COIs). This is an immediate critical requirement to supporting ""the fight tonight"" current ongoing overseas contingency operations in the USCENTCOM Area of Responsibility (AOR) which includes Operations Freedom's Sentinel, Inherent Resolve, Spartan Shield, and Gallant Phoenix. The MPE-IS applies modern technologies and processes to improve warfighter agility and reduce associated infrastructure, support and maintenance of information sharing costs. If funds are not received, USCENTCOM will not have the ability to allow rapid creation of multinational COIs to support all phases of military operations, day-to-day security cooperation, in addition to improving the operati","16-30_PA_August_2016_Request.pdf"
