"appropriation_category","appropriation code","appropriation activity","branch","fiscal_year_start","fiscal_year_end","budget_activity_number","budget_activity_title","pem","budget_title","program_base_congressional","program_base_dod","reprogramming_amount","revised_program_total","explanation","file"
"Operation and Maintenance","","","","2019","2004","01","Operating Forces","","ARMY INCREASES
","19","19","01","40,717,232","Funds are required for the following efforts: ° $+22.3 million for the operational sustainment of onecontractor-owned, contractor-operated (COCO) aircraft to provide multi-intelligence support toa COCOM. This is an OCO budget requirement. ° $+1.5 million for contract linguists to increase processing, exploitation, and dissemination capability within a COCOM. This is an OCO budget requirement.","19-04_IR_ISR_Transfer.pdf"
"Operation and Maintenance","","","","2019","2004","01","Operating Forces","","Program Base Reflecting Program Previously Reprogramming Action Revised Program
Congressional Action Approved by Sec Def
ee pp le PT

","60,400","19","19","54,500","Funds are required for the following efforts:","19-04_IR_ISR_Transfer.pdf"
"Operation and Maintenance","","","","","","01","Operating Forces","","","1,990","19","19","1,990","Funds are required for the following efforts:","19-04_IR_ISR_Transfer.pdf"
"Operation and Maintenance","","","Air Force","2019","2004","01","Operating Forces","","DEFENSE-WIDE INCREASES
","19","19","01","8,974,504","Funds are required for the following efforts:","19-04_IR_ISR_Transfer.pdf"
"Operation and Maintenance","","","","2019","2004","04","Administration and Servicewide Activities","","Defense-Wide
","155,092","19","19","155,092","Funds are available for transfer under section 9018 of the DoD Appropriations Act, 2019, which provided additional funds to improve the intelligence, surveillance, and reconnaissance capabilities of the DoD. This is Title IX OCO budget funding.","19-04_IR_ISR_Transfer.pdf"
"Procurement","","","","","","02","Communications and Electronics Equipment","","ARMY INCREASE
","19","21","02","19,540","Funds will procure improvements in hardware and software for processing, exploitation. and dissemination capabilities ina COCOM. This is a MIP project. This is an OCO budget requirement.","19-04_IR_ISR_Transfer.pdf"
"","","","Army","","","02","Communications and Electronics Equipment","","NAVY INCREASE
","19","21","02","19,009","Funds will be used to procure and install improved CCOP sensors aboard U.S. Navy ships to improve platform and theater force protection and indications and warning ina COCOM. This is a MIP project. This is an OCO budget requirement.","19-04_IR_ISR_Transfer.pdf"
"","","","Army","2019","2004","01","Major Equipment","","DEFENSE-WIDE INCREASE
","19","21","01","5,000","Funds are required for procurement, installation and establishment of a cloud-enabled | intelligence node to meet COCOM current intelligence product needs. This is a MIP project. This is | an OCO budget requirement.","19-04_IR_ISR_Transfer.pdf"
"Operation and Maintenance","","","Defense-Wide","","","04","Administration and Servicewide Activities","","DEFENSE-WIDE DECREASE
","19","19","04","115","-","19-04_IR_ISR_Transfer.pdf"
