"appropriation_category","appropriation code","appropriation activity","branch","fiscal_year_start","fiscal_year_end","budget_activity_number","budget_activity_title","pem","budget_title","program_base_congressional","program_base_dod","reprogramming_amount","revised_program_total","explanation","file"
"","","","","2020","2001","","","","PART If ie
","1,469,000","558,000","16","1","Funds are available because they are excess to current programmatic need, as follows:","20-01_RA_Support_for_DHS_Counter_Drug_Activity.pdf"
"Procurement","","","","2021","2021","","","","Congressional Action a by Sec Def
j

","20","22","329,000","02","Funds are available because they are early to current programmatic need. The period of performance for the contract is not expected to begin until FY 2021, therefore procurement can be irescheduled to a later fiscal year. This is a congressional special interest item.","20-01_RA_Support_for_DHS_Counter_Drug_Activity.pdf"
"","","","","2018","2018","","","","","1,300,000","1,300,000","1,300,000","205,000","Funds are available because they are early to current programmatic need. This appropriation is’ underexecuting prior year funds. As of December 31, 2019, a balance of $1.6 billion from FY 2018 and","20-01_RA_Support_for_DHS_Counter_Drug_Activity.pdf"
