"appropriation_category","appropriation code","appropriation activity","branch","fiscal_year_start","fiscal_year_end","budget_activity_number","budget_activity_title","pem","budget_title","program_base_congressional","program_base_dod","reprogramming_amount","revised_program_total","explanation","file"
"","","","","","","01","Reserve Component Training and Support","","ARMY INCREASES
","20","20","01","4,958,638","-","20-09_IR_January_2020_Request.pdf"
"","","","Army","2020","2009","01","Reserve Component Training and Support","","NAVY INCREASES
","20","20","01","2,130,119","-","20-09_IR_January_2020_Request.pdf"
"","","","Navy","2020","2020","01","Reserve Component Training and Support","","AIR FORCE INCREASES
","20","20","01","2,033,794","-","20-09_IR_January_2020_Request.pdf"
"Operation and Maintenance","","","Air Force","","","04","Administration and Servicewide Activities","","DEFENSE-WIDE DECREASE
","20","20","04","260,668","This action transfers funds from the Operation and Maintenance, Defense-Wide, 20/20, appropriation to Reserve Component Personnel appropriations to execute the Department's Civil Military Program. The funds will finance costs associated with the Reserve Components’ Active Duty for Training (ADT), travel and applicable statutory allowances, and will provide support and services to eligible","20-09_IR_January_2020_Request.pdf"
