"appropriation_category","appropriation code","appropriation activity","branch","fiscal_year_start","fiscal_year_end","budget_activity_number","budget_activity_title","pem","budget_title","program_base_congressional","program_base_dod","reprogramming_amount","revised_program_total","explanation","file"
"","","","","","","","","","","932","237","9","932","Funds are returned to National Guard Personnel, Army, after being previously transferred to Military Personnel, Army pursuant to Section 13001 of the CARES Act, as the funds are no longer required in Military Personnel, Army. This is a CARES Act division B, Title III, requirement.","20-36_IR_CARES_Act_PPE_Realignment.pdf"
"","","","Army","2020","2036","","","","ARMY DECREASES","20","20","02","27,230,746","Funds are available for transfer because the Army began to ship new recruits to basic training earlier and faster than initially expected. This greatly reduced the number of Service Members entitled to ‘Delayed Shipment Incentive, freeing funds for realignment to other Department COVID-19 requirements. This is Division B, Title III, CARES Act funding.","20-36_IR_CARES_Act_PPE_Realignment.pdf"
"","","","","2020","2020","","","","ARMY INCREASE
","45,671,757","45,671,757","53,800","45,725,557","Funds are required for non-medical Personal Protective Equipment (PPE) to limit the transmission of infections in order to protect the force and ensure the continuation of the Army’s missions. This is a CARES Act division B, Title III, requirement.","20-36_IR_CARES_Act_PPE_Realignment.pdf"
"","","","Army","","","","","","","9,376,179","253","380","0","Funds are available for transfer because the DoD is fully reimbursed for National Guard support to the States provided under the Stafford Act pursuant to validated Federal Emergency Management Agency mission assignments and support provided to Department of Health and Human Services under the |","20-36_IR_CARES_Act_PPE_Realignment.pdf"
