"appropriation_category","appropriation code","appropriation activity","branch","fiscal_year_start","fiscal_year_end","budget_activity_number","budget_activity_title","pem","budget_title","program_base_congressional","program_base_dod","reprogramming_amount","revised_program_total","explanation","file"
"","","","","2023","2003","","","","AIR FORCE INCREASE
","22","24","05","25","Funds are required to: procure: VC-25A modifications for the Block Upgrade. program, which","23-03_PA_December_2022.pdf"
"","","","Air Force","2022","2022","06","Aircraft Spares and Repair Parts","","AIR FORCE DECREASE
","22","24","06","1,006,161","Funds are available to procure VC-25A modifications for the Block Upgrade program because they are excess to need for the E-3 Airborne Warning and Control System (AWACS). There are no other known program requirements for the funding at this time and no major impacts to the program.","23-03_PA_December_2022.pdf"
"Missile Procurement","","","Air Force","2022","2011","02","Other Missiles","0604182A","ARMY INCREASES
","22","24","02","33","Funds are required to procure 24 Stinger Vehicle Universal Launchers (SVULs) which are required for production and delivery of Maneuver Short Range Air Defense (M-SHORAD) Inc 1 systems. This request is not related to the Army’s support to Ukraine. This requirement was previously approved via the FY 22-11 PA reprogramming action, however, the Army was unable to fund due to a lack of approved sources. The Army was able to break the requirement into smaller procurements.","23-03_PA_December_2022.pdf"
"Procurement","","","","2022","2022","04","Support Equipment and Facilities","0605232A","ARMY DECREASES
","22","24","04","62,961","Funds are available due to the initial B-Kit procurement for APR-39E(V)2 countermeasure equipment originally scheduled for FY 2022 that moved to FY 2023. This is due to a need for additional Joint Preflight Integration of Munitions and Electronic Systems (JPRIMES) testing and a shift in contract strategy. The production decision has been delayed until system qualification and performance testing can be completed to show stability in design.","23-03_PA_December_2022.pdf"
