"appropriation_category","appropriation code","appropriation activity","branch","fiscal_year_start","fiscal_year_end","budget_activity_number","budget_activity_title","pem","budget_title","program_base_congressional","program_base_dod","reprogramming_amount","revised_program_total","explanation","file"
"Operation and Maintenance","","","","2024","2036","","","","Approved (Signature and Date)","290.040","24","24","24,339","Funds are required for the reimbursement of ‘transportation services provided to Ukraine in support of the international effort to counter Russian aggression: This is a congressional special interest. item. This is an emergency budget requirement.","24-36_IR_Ukraine_Tranche_21_signed_20240625.pdf"
"Operation and Maintenance","","","","2024","2024","04","Administration and Servicewide Activities","","Ukraine Replacement Transfer Fund
","290,040","23","24","290,040","Funds are available from the Operation and Maintenance, Defense-Wide, 23/24, appropriation for replacement of defense articles from the stocks of the Department of Defense and reimbursement for","24-36_IR_Ukraine_Tranche_21_signed_20240625.pdf"
"Operation and Maintenance","","","Defense-Wide","2024","2036","01","Operating Forces","","ARMY INCREASES
","24","24","01","38,506,076","Funds are required for the replacement of M2 aiming circle kits and M109 spare cannon tubes provided to Ukraine in support of the international effort to counter Russian aggression. This is a congressional special interest item. This is an emergency budget requirement.","24-36_IR_Ukraine_Tranche_21_signed_20240625.pdf"
"Operation and Maintenance","","","","2024","2036","04","Administration and Service-Wide Activities","","NAVY INCREASES","24","24","04","6,441,132","Funds are required for the reimbursement of defense services required to prepare various equipment for movement via air or sea transportation, and transportation of equipment transferred to Ukraine in support of the international! effort to counter Russian aggression. This i is a congressional special interest item. This is an emergency budget requirement.","24-36_IR_Ukraine_Tranche_21_signed_20240625.pdf"
"Operation and Maintenance","","","","2024","2036","02","Mobilization","","Joint Strike Missile
","159.456","24","24","56,456","Funds are required for the reimbursement of transportation services provided to Ukraine in support of the international effort to counter Russian aggression. This is a congressional special interest item. This is an emergency budget requirement.","24-36_IR_Ukraine_Tranche_21_signed_20240625.pdf"
"Operation and Maintenance","","","","2024","2024","01","Operating Forces","","","8,560","150","24","24","Funds are required for the reimbursement of transportation services provided to Ukraine in support of the international effort to counter Russian aggression. This is a congressional special interest item. This is an emergency budget requirement.","24-36_IR_Ukraine_Tranche_21_signed_20240625.pdf"
"Operation and Maintenance","","","Defense-Wide","","","04","Administration and Servicewide Activities","","Ukraine Replacement Transfer Fund
","317,520","23","24","317,520","Funds are available from the Operation and Maintenance, Defense-Wide, 23/24, appropriation for replacement of defense articles from the stocks of the Department of Defense and reimbursement for","24-36_IR_Ukraine_Tranche_21_signed_20240625.pdf"
