"appropriation_category","appropriation code","appropriation activity","branch","fiscal_year_start","fiscal_year_end","budget_activity_number","budget_activity_title","pem","budget_title","program_base_congressional","program_base_dod","reprogramming_amount","revised_program_total","explanation","file"
"Operation and Maintenance","","","","2025","2012","","","","Mane J Piiae
","501,029","25","25","384,134","Funds are required for the reimbursement of transportation services, parts, repair services, Packing, Crating & Handling (PC&H), and training required to provide support to Taiwan and the replacement of body armor provided to Taiwan or identified and notified to Congress through this reprogramming action for provision to Taiwan in support of the international effort to deter conflict in the Indo-Pacific region. This is a congressional special interest item. This is an emergency budget requirement.","25-12_IR_Taiwan_Replacement_Transfer_Fund_IR_Tranche_2.pdf"
"Operation and Maintenance","","","","2025","2012","01","Operating Forces","","NAVY INCREASES
","25","25","01","15,224","Funds are required for the reimbursement of consumable supplies and fuel provided to Taiwan pursuant to Presidential Drawdown Authority to deter conflict in the Indo-Pacific region. This is a congressional special interest item. This is an emergency budget requirement.","25-12_IR_Taiwan_Replacement_Transfer_Fund_IR_Tranche_2.pdf"
"Operation and Maintenance","","","","","","04","Administration and Servicewide Activities","","","518,467","518,467","24","25","Funds are available from the Operation and Maintenance, Defense-Wide, 24/25, appropriation for replacement of defense articles from the stocks of the Department of Defense and reimbursement for defense services from the Department of Defense, which have been or will be provided to Taiwan or identified and notified to Congress through this reprogramming action for provision to Taiwan under Presidential Drawdown Authority. This is emergency budget funding.","25-12_IR_Taiwan_Replacement_Transfer_Fund_IR_Tranche_2.pdf"
